### ISSUE TITLE
udp communication from host os to pod dropped in case of multi-node cluster

### ISSUE THREAD

**Issue by masato-yoshi-dnsalias-com** [canonical/microk8s#3519]
[inspection-report.zip](https://github.com/canonical/microk8s/files/9827771/inspection-report.zip)

#### Summary

In case of multi-node cluster, udp communication from host OS to pod is dropped.
ex.
  dns lookup

There is no problem with dns lookup from the host where coredns is running, but dns lookup from the host where pod is not running is timed out and lookup is not possible.

For tcp communication, connection is established by SYN retry.

If caclico's virtual nic is specified as the source address, lookup can be performed normally.

dig @yyy.yyy.yyy kube-dns.kube-system.svc.cluster.local -b xxx.xxx.xxx.xxx

#### Reproduction Steps

1. snap install microk8s --classic
2. microk8s add-node
3. microk8s join 172.17.0.1:25000/2ef96642f181fc79c33ac498462584c8/f5d952c3be0d
4. microk8s enable dns
5. nslookup kube-dns.kube-system.svc.cluster.local xxx.xxx.xxx.xxx

#### Can you suggest a fix?

Since the daemonset pod cannot perform dns lookup, it is not possible to communicate with the host name, so please fix it.
However, it can be avoided by specifying a dns server outside the pod in nameserevrs of dnsconfig, but it will take time because it will be a multi-stage search.

#### Are you interested in contributing with a fix?

Yes

### NG Case

> nslookup kube-dns.kube-system.svc.cluster.local 10.152.183.10
tcpdump -i any -n port 4789

> 

15:16:58.198185 enp1s0 P   IP 172.17.0.1.62240 > 172.17.0.2.4789: VXLAN, flags [I] (0x08), vni 4096
IP 10.1.174.128.6610 > 10.1.230.1.53: 3638+ A? kube-dns.kube-system.svc.cluster.local. (56)
15:16:58.198185 br-flat In  IP 172.17.0.1.62240 > 172.17.0.2.4789: VXLAN, flags [I] (0x08), vni 4096
IP 10.1.174.128.6610 > 10.1.230.1.53: 3638+ A? kube-dns.kube-system.svc.cluster.local. (56)_
> 

> iptables trace
iptables-legacy -t raw -I PREROUTING -p udp -s 172.17.0.1 -d 172.17.0.2 --dport 4789 -j TRACE

Oct 20 15:16:58 os-com-02 kernel: [ 2978.462577] TRACE: raw:PREROUTING:rule:2 IN=br-flat OUT= PHYSIN=enp1s0 MAC=9e:c2:81:f7:a7:12:1a:22:39:93:45:e7:08:00 SRC=172.17.0.1 DST=172.17.0.2 LEN=134 TOS=0x00 PREC=0x00 TTL=64 ID=42592 PROTO=UDP SPT=62240 DPT=4789 LEN=114
Oct 20 15:16:58 os-com-02 kernel: [ 2978.462599] TRACE: raw:cali-PREROUTING:rule:1 IN=br-flat OUT= PHYSIN=enp1s0 MAC=9e:c2:81:f7:a7:12:1a:22:39:93:45:e7:08:00 SRC=172.17.0.1 DST=172.17.0.2 LEN=134 TOS=0x00 PREC=0x00 TTL=64 ID=42592 PROTO=UDP SPT=62240 DPT=4789 LEN=114
Oct 20 15:16:58 os-com-02 kernel: [ 2978.462602] TRACE: raw:cali-PREROUTING:rule:5 IN=br-flat OUT= PHYSIN=enp1s0 MAC=9e:c2:81:f7:a7:12:1a:22:39:93:45:e7:08:00 SRC=172.17.0.1 DST=172.17.0.2 LEN=134 TOS=0x00 PREC=0x00 TTL=64 ID=42592 PROTO=UDP SPT=62240 DPT=4789 LEN=114
Oct 20 15:16:58 os-com-02 kernel: [ 2978.462604] TRACE: raw:cali-from-host-endpoint:return:1 IN=br-flat OUT= PHYSIN=enp1s0 MAC=9e:c2:81:f7:a7:12:1a:22:39:93:45:e7:08:00 SRC=172.17.0.1 DST=172.17.0.2 LEN=134 TOS=0x00 PREC=0x00 TTL=64 ID=42592 PROTO=UDP SPT=62240 DPT=4789 LEN=114
Oct 20 15:16:58 os-com-02 kernel: [ 2978.462607] TRACE: raw:cali-PREROUTING:return:7 IN=br-flat OUT= PHYSIN=enp1s0 MAC=9e:c2:81:f7:a7:12:1a:22:39:93:45:e7:08:00 SRC=172.17.0.1 DST=172.17.0.2 LEN=134 TOS=0x00 PREC=0x00 TTL=64 ID=42592 PROTO=UDP SPT=62240 DPT=4789 LEN=114
Oct 20 15:16:58 os-com-02 kernel: [ 2978.462609] TRACE: raw:PREROUTING:policy:3 IN=br-flat OUT= PHYSIN=enp1s0 MAC=9e:c2:81:f7:a7:12:1a:22:39:93:45:e7:08:00 SRC=172.17.0.1 DST=172.17.0.2 LEN=134 TOS=0x00 PREC=0x00 TTL=64 ID=42592 PROTO=UDP SPT=62240 DPT=4789 LEN=114
Oct 20 15:16:58 os-com-02 kernel: [ 2978.462618] TRACE: mangle:PREROUTING:rule:1 IN=br-flat OUT= PHYSIN=enp1s0 MAC=9e:c2:81:f7:a7:12:1a:22:39:93:45:e7:08:00 SRC=172.17.0.1 DST=172.17.0.2 LEN=134 TOS=0x00 PREC=0x00 TTL=64 ID=42592 PROTO=UDP SPT=62240 DPT=4789 LEN=114
Oct 20 15:16:58 os-com-02 kernel: [ 2978.462621] TRACE: mangle:cali-PREROUTING:rule:3 IN=br-flat OUT= PHYSIN=enp1s0 MAC=9e:c2:81:f7:a7:12:1a:22:39:93:45:e7:08:00 SRC=172.17.0.1 DST=172.17.0.2 LEN=134 TOS=0x00 PREC=0x00 TTL=64 ID=42592 PROTO=UDP SPT=62240 DPT=4789 LEN=114
Oct 20 15:16:58 os-com-02 kernel: [ 2978.462624] TRACE: mangle:cali-from-host-endpoint:return:1 IN=br-flat OUT= PHYSIN=enp1s0 MAC=9e:c2:81:f7:a7:12:1a:22:39:93:45:e7:08:00 SRC=172.17.0.1 DST=172.17.0.2 LEN=134 TOS=0x00 PREC=0x00 TTL=64 ID=42592 PROTO=UDP SPT=62240 DPT=4789 LEN=114
Oct 20 15:16:58 os-com-02 kernel: [ 2978.462626] TRACE: mangle:cali-PREROUTING:return:5 IN=br-flat OUT= PHYSIN=enp1s0 MAC=9e:c2:81:f7:a7:12:1a:22:39:93:45:e7:08:00 SRC=172.17.0.1 DST=172.17.0.2 LEN=134 TOS=0x00 PREC=0x00 TTL=64 ID=42592 PROTO=UDP SPT=62240 DPT=4789 LEN=114
Oct 20 15:16:58 os-com-02 kernel: [ 2978.462628] TRACE: mangle:PREROUTING:policy:2 IN=br-flat OUT= PHYSIN=enp1s0 MAC=9e:c2:81:f7:a7:12:1a:22:39:93:45:e7:08:00 SRC=172.17.0.1 DST=172.17.0.2 LEN=134 TOS=0x00 PREC=0x00 TTL=64 ID=42592 PROTO=UDP SPT=62240 DPT=4789 LEN=114
Oct 20 15:16:58 os-com-02 kernel: [ 2978.462638] TRACE: mangle:INPUT:policy:1 IN=br-flat OUT= PHYSIN=enp1s0 MAC=9e:c2:81:f7:a7:12:1a:22:39:93:45:e7:08:00 SRC=172.17.0.1 DST=172.17.0.2 LEN=134 TOS=0x00 PREC=0x00 TTL=64 ID=42592 PROTO=UDP SPT=62240 DPT=4789 LEN=114
Oct 20 15:16:58 os-com-02 kernel: [ 2978.462642] TRACE: filter:INPUT:rule:1 IN=br-flat OUT= PHYSIN=enp1s0 MAC=9e:c2:81:f7:a7:12:1a:22:39:93:45:e7:08:00 SRC=172.17.0.1 DST=172.17.0.2 LEN=134 TOS=0x00 PREC=0x00 TTL=64 ID=42592 PROTO=UDP SPT=62240 DPT=4789 LEN=114
Oct 20 15:16:58 os-com-02 kernel: [ 2978.462649] TRACE: filter:cali-INPUT:rule:1 IN=br-flat OUT= PHYSIN=enp1s0 MAC=9e:c2:81:f7:a7:12:1a:22:39:93:45:e7:08:00 SRC=172.17.0.1 DST=172.17.0.2 LEN=134 TOS=0x00 PREC=0x00 TTL=64 ID=42592 PROTO=UDP SPT=62240 DPT=4789 LEN=114

-------------------------------------------------------------------------------

OK Case

> ip netns exec cni-46220c31-661d-cdb6-089f-a8e6a1af0340 nslookup kube-dns.kube-system.svc.cluster.local 10.152.183.10

15:20:46.279447 enp1s0 P   IP 172.17.0.1.57381 > 172.17.0.2.4789: VXLAN, flags [I] (0x08), vni 4096
IP 10.1.174.129.36638 > 10.1.230.1.53: 1608+ A? kube-dns.kube-system.svc.cluster.local. (56)
15:20:46.279447 br-flat In  IP 172.17.0.1.57381 > 172.17.0.2.4789: VXLAN, flags [I] (0x08), vni 4096
IP 10.1.174.129.36638 > 10.1.230.1.53: 1608+ A? kube-dns.kube-system.svc.cluster.local. (56)
15:20:46.279789 br-flat Out IP 172.17.0.2.58633 > 172.17.0.1.4789: VXLAN, flags [I] (0x08), vni 4096
IP 10.1.230.1.53 > 10.1.174.129.36638: 1608*- 1/0/0 A 10.152.183.10 (110)
15:20:46.279792 enp1s0 Out IP 172.17.0.2.58633 > 172.17.0.1.4789: VXLAN, flags [I] (0x08), vni 4096
IP 10.1.230.1.53 > 10.1.174.129.36638: 1608*- 1/0/0 A 10.152.183.10 (110)
15:20:46.280149 enp1s0 P   IP 172.17.0.1.58023 > 172.17.0.2.4789: VXLAN, flags [I] (0x08), vni 4096
IP 10.1.174.129.47296 > 10.1.230.1.53: 51705+ AAAA? kube-dns.kube-system.svc.cluster.local. (56)
15:20:46.280149 br-flat In  IP 172.17.0.1.58023 > 172.17.0.2.4789: VXLAN, flags [I] (0x08), vni 4096
IP 10.1.174.129.47296 > 10.1.230.1.53: 51705+ AAAA? kube-dns.kube-system.svc.cluster.local. (56)
15:20:46.280386 br-flat Out IP 172.17.0.2.42367 > 172.17.0.1.4789: VXLAN, flags [I] (0x08), vni 4096
IP 10.1.230.1.53 > 10.1.174.129.47296: 51705*- 0/1/0 (149)
15:20:46.280388 enp1s0 Out IP 172.17.0.2.42367 > 172.17.0.1.4789: VXLAN, flags [I] (0x08), vni 4096
IP 10.1.230.1.53 > 10.1.174.129.47296: 51705*- 0/1/0 (149)

Oct 20 15:20:46 os-com-02 kernel: [ 3206.543019] TRACE: raw:PREROUTING:policy:3 IN=br-flat OUT= PHYSIN=enp1s0 MAC=9e:c2:81:f7:a7:12:1a:22:39:93:45:e7:08:00 SRC=172.17.0.1 DST=172.17.0.2 LEN=134 TOS=0x00 PREC=0x00 TTL=64 ID=58382 PROTO=UDP SPT=57381 DPT=4789 LEN=114
Oct 20 15:20:46 os-com-02 kernel: [ 3206.543044] TRACE: mangle:PREROUTING:rule:1 IN=br-flat OUT= PHYSIN=enp1s0 MAC=9e:c2:81:f7:a7:12:1a:22:39:93:45:e7:08:00 SRC=172.17.0.1 DST=172.17.0.2 LEN=134 TOS=0x00 PREC=0x00 TTL=64 ID=58382 PROTO=UDP SPT=57381 DPT=4789 LEN=114
Oct 20 15:20:46 os-com-02 kernel: [ 3206.543047] TRACE: mangle:cali-PREROUTING:rule:3 IN=br-flat OUT= PHYSIN=enp1s0 MAC=9e:c2:81:f7:a7:12:1a:22:39:93:45:e7:08:00 SRC=172.17.0.1 DST=172.17.0.2 LEN=134 TOS=0x00 PREC=0x00 TTL=64 ID=58382 PROTO=UDP SPT=57381 DPT=4789 LEN=114
Oct 20 15:20:46 os-com-02 kernel: [ 3206.543050] TRACE: mangle:cali-from-host-endpoint:return:1 IN=br-flat OUT= PHYSIN=enp1s0 MAC=9e:c2:81:f7:a7:12:1a:22:39:93:45:e7:08:00 SRC=172.17.0.1 DST=172.17.0.2 LEN=134 TOS=0x00 PREC=0x00 TTL=64 ID=58382 PROTO=UDP SPT=57381 DPT=4789 LEN=114
Oct 20 15:20:46 os-com-02 kernel: [ 3206.543052] TRACE: mangle:cali-PREROUTING:return:5 IN=br-flat OUT= PHYSIN=enp1s0 MAC=9e:c2:81:f7:a7:12:1a:22:39:93:45:e7:08:00 SRC=172.17.0.1 DST=172.17.0.2 LEN=134 TOS=0x00 PREC=0x00 TTL=64 ID=58382 PROTO=UDP SPT=57381 DPT=4789 LEN=114
Oct 20 15:20:46 os-com-02 kernel: [ 3206.543055] TRACE: mangle:PREROUTING:policy:2 IN=br-flat OUT= PHYSIN=enp1s0 MAC=9e:c2:81:f7:a7:12:1a:22:39:93:45:e7:08:00 SRC=172.17.0.1 DST=172.17.0.2 LEN=134 TOS=0x00 PREC=0x00 TTL=64 ID=58382 PROTO=UDP SPT=57381 DPT=4789 LEN=114
Oct 20 15:20:46 os-com-02 kernel: [ 3206.543058] TRACE: nat:PREROUTING:rule:1 IN=br-flat OUT= PHYSIN=enp1s0 MAC=9e:c2:81:f7:a7:12:1a:22:39:93:45:e7:08:00 SRC=172.17.0.1 DST=172.17.0.2 LEN=134 TOS=0x00 PREC=0x00 TTL=64 ID=58382 PROTO=UDP SPT=57381 DPT=4789 LEN=114
Oct 20 15:20:46 os-com-02 kernel: [ 3206.543062] TRACE: nat:cali-PREROUTING:rule:1 IN=br-flat OUT= PHYSIN=enp1s0 MAC=9e:c2:81:f7:a7:12:1a:22:39:93:45:e7:08:00 SRC=172.17.0.1 DST=172.17.0.2 LEN=134 TOS=0x00 PREC=0x00 TTL=64 ID=58382 PROTO=UDP SPT=57381 DPT=4789 LEN=114
Oct 20 15:20:46 os-com-02 kernel: [ 3206.543065] TRACE: nat:cali-fip-dnat:return:1 IN=br-flat OUT= PHYSIN=enp1s0 MAC=9e:c2:81:f7:a7:12:1a:22:39:93:45:e7:08:00 SRC=172.17.0.1 DST=172.17.0.2 LEN=134 TOS=0x00 PREC=0x00 TTL=64 ID=58382 PROTO=UDP SPT=57381 DPT=4789 LEN=114
Oct 20 15:20:46 os-com-02 kernel: [ 3206.543068] TRACE: nat:cali-PREROUTING:return:2 IN=br-flat OUT= PHYSIN=enp1s0 MAC=9e:c2:81:f7:a7:12:1a:22:39:93:45:e7:08:00 SRC=172.17.0.1 DST=172.17.0.2 LEN=134 TOS=0x00 PREC=0x00 TTL=64 ID=58382 PROTO=UDP SPT=57381 DPT=4789 LEN=114
Oct 20 15:20:46 os-com-02 kernel: [ 3206.543070] TRACE: nat:PREROUTING:rule:2 IN=br-flat OUT= PHYSIN=enp1s0 MAC=9e:c2:81:f7:a7:12:1a:22:39:93:45:e7:08:00 SRC=172.17.0.1 DST=172.17.0.2 LEN=134 TOS=0x00 PREC=0x00 TTL=64 ID=58382 PROTO=UDP SPT=57381 DPT=4789 LEN=114
Oct 20 15:20:46 os-com-02 kernel: [ 3206.543075] TRACE: nat:KUBE-SERVICES:rule:5 IN=br-flat OUT= PHYSIN=enp1s0 MAC=9e:c2:81:f7:a7:12:1a:22:39:93:45:e7:08:00 SRC=172.17.0.1 DST=172.17.0.2 LEN=134 TOS=0x00 PREC=0x00 TTL=64 ID=58382 PROTO=UDP SPT=57381 DPT=4789 LEN=114
Oct 20 15:20:46 os-com-02 kernel: [ 3206.543077] TRACE: nat:KUBE-NODEPORTS:return:1 IN=br-flat OUT= PHYSIN=enp1s0 MAC=9e:c2:81:f7:a7:12:1a:22:39:93:45:e7:08:00 SRC=172.17.0.1 DST=172.17.0.2 LEN=134 TOS=0x00 PREC=0x00 TTL=64 ID=58382 PROTO=UDP SPT=57381 DPT=4789 LEN=114
Oct 20 15:20:46 os-com-02 kernel: [ 3206.543080] TRACE: nat:KUBE-SERVICES:return:6 IN=br-flat OUT= PHYSIN=enp1s0 MAC=9e:c2:81:f7:a7:12:1a:22:39:93:45:e7:08:00 SRC=172.17.0.1 DST=172.17.0.2 LEN=134 TOS=0x00 PREC=0x00 TTL=64 ID=58382 PROTO=UDP SPT=57381 DPT=4789 LEN=114
Oct 20 15:20:46 os-com-02 kernel: [ 3206.543082] TRACE: nat:PREROUTING:policy:3 IN=br-flat OUT= PHYSIN=enp1s0 MAC=9e:c2:81:f7:a7:12:1a:22:39:93:45:e7:08:00 SRC=172.17.0.1 DST=172.17.0.2 LEN=134 TOS=0x00 PREC=0x00 TTL=64 ID=58382 PROTO=UDP SPT=57381 DPT=4789 LEN=114
Oct 20 15:20:46 os-com-02 kernel: [ 3206.543090] TRACE: mangle:INPUT:policy:1 IN=br-flat OUT= PHYSIN=enp1s0 MAC=9e:c2:81:f7:a7:12:1a:22:39:93:45:e7:08:00 SRC=172.17.0.1 DST=172.17.0.2 LEN=134 TOS=0x00 PREC=0x00 TTL=64 ID=58382 PROTO=UDP SPT=57381 DPT=4789 LEN=114
Oct 20 15:20:46 os-com-02 kernel: [ 3206.543094] TRACE: filter:INPUT:rule:1 IN=br-flat OUT= PHYSIN=enp1s0 MAC=9e:c2:81:f7:a7:12:1a:22:39:93:45:e7:08:00 SRC=172.17.0.1 DST=172.17.0.2 LEN=134 TOS=0x00 PREC=0x00 TTL=64 ID=58382 PROTO=UDP SPT=57381 DPT=4789 LEN=114
Oct 20 15:20:46 os-com-02 kernel: [ 3206.543100] TRACE: filter:cali-INPUT:rule:1 IN=br-flat OUT= PHYSIN=enp1s0 MAC=9e:c2:81:f7:a7:12:1a:22:39:93:45:e7:08:00 SRC=172.17.0.1 DST=172.17.0.2 LEN=134 TOS=0x00 PREC=0x00 TTL=64 ID=58382 PROTO=UDP SPT=57381 DPT=4789 LEN=114
Oct 20 15:20:46 os-com-02 kernel: [ 3206.543103] TRACE: nat:INPUT:policy:1 IN=br-flat OUT= PHYSIN=enp1s0 MAC=9e:c2:81:f7:a7:12:1a:22:39:93:45:e7:08:00 SRC=172.17.0.1 DST=172.17.0.2 LEN=134 TOS=0x00 PREC=0x00 TTL=64 ID=58382 PROTO=UDP SPT=57381 DPT=4789 LEN=114
Oct 20 15:20:46 os-com-02 kernel: [ 3206.543715] TRACE: raw:PREROUTING:policy:3 IN=br-flat OUT= PHYSIN=enp1s0 MAC=9e:c2:81:f7:a7:12:1a:22:39:93:45:e7:08:00 SRC=172.17.0.1 DST=172.17.0.2 LEN=134 TOS=0x00 PREC=0x00 TTL=64 ID=58383 PROTO=UDP SPT=58023 DPT=4789 LEN=114
Oct 20 15:20:46 os-com-02 kernel: [ 3206.543732] TRACE: mangle:PREROUTING:rule:1 IN=br-flat OUT= PHYSIN=enp1s0 MAC=9e:c2:81:f7:a7:12:1a:22:39:93:45:e7:08:00 SRC=172.17.0.1 DST=172.17.0.2 LEN=134 TOS=0x00 PREC=0x00 TTL=64 ID=58383 PROTO=UDP SPT=58023 DPT=4789 LEN=114
Oct 20 15:20:46 os-com-02 kernel: [ 3206.543736] TRACE: mangle:cali-PREROUTING:rule:3 IN=br-flat OUT= PHYSIN=enp1s0 MAC=9e:c2:81:f7:a7:12:1a:22:39:93:45:e7:08:00 SRC=172.17.0.1 DST=172.17.0.2 LEN=134 TOS=0x00 PREC=0x00 TTL=64 ID=58383 PROTO=UDP SPT=58023 DPT=4789 LEN=114
Oct 20 15:20:46 os-com-02 kernel: [ 3206.543740] TRACE: mangle:cali-from-host-endpoint:return:1 IN=br-flat OUT= PHYSIN=enp1s0 MAC=9e:c2:81:f7:a7:12:1a:22:39:93:45:e7:08:00 SRC=172.17.0.1 DST=172.17.0.2 LEN=134 TOS=0x00 PREC=0x00 TTL=64 ID=58383 PROTO=UDP SPT=58023 DPT=4789 LEN=114
Oct 20 15:20:46 os-com-02 kernel: [ 3206.543744] TRACE: mangle:cali-PREROUTING:return:5 IN=br-flat OUT= PHYSIN=enp1s0 MAC=9e:c2:81:f7:a7:12:1a:22:39:93:45:e7:08:00 SRC=172.17.0.1 DST=172.17.0.2 LEN=134 TOS=0x00 PREC=0x00 TTL=64 ID=58383 PROTO=UDP SPT=58023 DPT=4789 LEN=114
Oct 20 15:20:46 os-com-02 kernel: [ 3206.543748] TRACE: mangle:PREROUTING:policy:2 IN=br-flat OUT= PHYSIN=enp1s0 MAC=9e:c2:81:f7:a7:12:1a:22:39:93:45:e7:08:00 SRC=172.17.0.1 DST=172.17.0.2 LEN=134 TOS=0x00 PREC=0x00 TTL=64 ID=58383 PROTO=UDP SPT=58023 DPT=4789 LEN=114
Oct 20 15:20:46 os-com-02 kernel: [ 3206.543752] TRACE: nat:PREROUTING:rule:1 IN=br-flat OUT= PHYSIN=enp1s0 MAC=9e:c2:81:f7:a7:12:1a:22:39:93:45:e7:08:00 SRC=172.17.0.1 DST=172.17.0.2 LEN=134 TOS=0x00 PREC=0x00 TTL=64 ID=58383 PROTO=UDP SPT=58023 DPT=4789 LEN=114
Oct 20 15:20:46 os-com-02 kernel: [ 3206.543757] TRACE: nat:cali-PREROUTING:rule:1 IN=br-flat OUT= PHYSIN=enp1s0 MAC=9e:c2:81:f7:a7:12:1a:22:39:93:45:e7:08:00 SRC=172.17.0.1 DST=172.17.0.2 LEN=134 TOS=0x00 PREC=0x00 TTL=64 ID=58383 PROTO=UDP SPT=58023 DPT=4789 LEN=114
Oct 20 15:20:46 os-com-02 kernel: [ 3206.543760] TRACE: nat:cali-fip-dnat:return:1 IN=br-flat OUT= PHYSIN=enp1s0 MAC=9e:c2:81:f7:a7:12:1a:22:39:93:45:e7:08:00 SRC=172.17.0.1 DST=172.17.0.2 LEN=134 TOS=0x00 PREC=0x00 TTL=64 ID=58383 PROTO=UDP SPT=58023 DPT=4789 LEN=114
Oct 20 15:20:46 os-com-02 kernel: [ 3206.543763] TRACE: nat:cali-PREROUTING:return:2 IN=br-flat OUT= PHYSIN=enp1s0 MAC=9e:c2:81:f7:a7:12:1a:22:39:93:45:e7:08:00 SRC=172.17.0.1 DST=172.17.0.2 LEN=134 TOS=0x00 PREC=0x00 TTL=64 ID=58383 PROTO=UDP SPT=58023 DPT=4789 LEN=114
Oct 20 15:20:46 os-com-02 kernel: [ 3206.543765] TRACE: nat:PREROUTING:rule:2 IN=br-flat OUT= PHYSIN=enp1s0 MAC=9e:c2:81:f7:a7:12:1a:22:39:93:45:e7:08:00 SRC=172.17.0.1 DST=172.17.0.2 LEN=134 TOS=0x00 PREC=0x00 TTL=64 ID=58383 PROTO=UDP SPT=58023 DPT=4789 LEN=114
Oct 20 15:20:46 os-com-02 kernel: [ 3206.543769] TRACE: nat:KUBE-SERVICES:rule:5 IN=br-flat OUT= PHYSIN=enp1s0 MAC=9e:c2:81:f7:a7:12:1a:22:39:93:45:e7:08:00 SRC=172.17.0.1 DST=172.17.0.2 LEN=134 TOS=0x00 PREC=0x00 TTL=64 ID=58383 PROTO=UDP SPT=58023 DPT=4789 LEN=114
Oct 20 15:20:46 os-com-02 kernel: [ 3206.543771] TRACE: nat:KUBE-NODEPORTS:return:1 IN=br-flat OUT= PHYSIN=enp1s0 MAC=9e:c2:81:f7:a7:12:1a:22:39:93:45:e7:08:00 SRC=172.17.0.1 DST=172.17.0.2 LEN=134 TOS=0x00 PREC=0x00 TTL=64 ID=58383 PROTO=UDP SPT=58023 DPT=4789 LEN=114
Oct 20 15:20:46 os-com-02 kernel: [ 3206.543774] TRACE: nat:KUBE-SERVICES:return:6 IN=br-flat OUT= PHYSIN=enp1s0 MAC=9e:c2:81:f7:a7:12:1a:22:39:93:45:e7:08:00 SRC=172.17.0.1 DST=172.17.0.2 LEN=134 TOS=0x00 PREC=0x00 TTL=64 ID=58383 PROTO=UDP SPT=58023 DPT=4789 LEN=114
Oct 20 15:20:46 os-com-02 kernel: [ 3206.543776] TRACE: nat:PREROUTING:policy:3 IN=br-flat OUT= PHYSIN=enp1s0 MAC=9e:c2:81:f7:a7:12:1a:22:39:93:45:e7:08:00 SRC=172.17.0.1 DST=172.17.0.2 LEN=134 TOS=0x00 PREC=0x00 TTL=64 ID=58383 PROTO=UDP SPT=58023 DPT=4789 LEN=114
Oct 20 15:20:46 os-com-02 kernel: [ 3206.543781] TRACE: mangle:INPUT:policy:1 IN=br-flat OUT= PHYSIN=enp1s0 MAC=9e:c2:81:f7:a7:12:1a:22:39:93:45:e7:08:00 SRC=172.17.0.1 DST=172.17.0.2 LEN=134 TOS=0x00 PREC=0x00 TTL=64 ID=58383 PROTO=UDP SPT=58023 DPT=4789 LEN=114
Oct 20 15:20:46 os-com-02 kernel: [ 3206.543784] TRACE: filter:INPUT:rule:1 IN=br-flat OUT= PHYSIN=enp1s0 MAC=9e:c2:81:f7:a7:12:1a:22:39:93:45:e7:08:00 SRC=172.17.0.1 DST=172.17.0.2 LEN=134 TOS=0x00 PREC=0x00 TTL=64 ID=58383 PROTO=UDP SPT=58023 DPT=4789 LEN=114
Oct 20 15:20:46 os-com-02 kernel: [ 3206.543788] TRACE: filter:cali-INPUT:rule:1 IN=br-flat OUT= PHYSIN=enp1s0 MAC=9e:c2:81:f7:a7:12:1a:22:39:93:45:e7:08:00 SRC=172.17.0.1 DST=172.17.0.2 LEN=134 TOS=0x00 PREC=0x00 TTL=64 ID=58383 PROTO=UDP SPT=58023 DPT=4789 LEN=114
Oct 20 15:20:46 os-com-02 kernel: [ 3206.543791] TRACE: nat:INPUT:policy:1 IN=br-flat OUT= PHYSIN=enp1s0 MAC=9e:c2:81:f7:a7:12:1a:22:39:93:45:e7:08:00 SRC=172.17.0.1 DST=172.17.0.2 LEN=134 TOS=0x00 PREC=0x00 TTL=64 ID=58383 PROTO=UDP SPT=58023 DPT=4789 LEN=114

iptables-legacy-save
-----
# Generated by iptables-save v1.8.7 on Thu Oct 20 15:21:33 2022
*raw
:PREROUTING ACCEPT [13077:24771150]
:OUTPUT ACCEPT [13264:2553521]
:cali-OUTPUT - [0:0]
:cali-PREROUTING - [0:0]
:cali-from-host-endpoint - [0:0]
:cali-rpf-skip - [0:0]
:cali-to-host-endpoint - [0:0]
-A PREROUTING -m comment --comment "cali:6gwbT8clXdHdC1b1" -j cali-PREROUTING
-A PREROUTING -s 172.17.0.1/32 -d 172.17.0.2/32 -p udp -m udp --dport 4789 -j TRACE
-A OUTPUT -m comment --comment "cali:tVnHkvAo15HuiPy0" -j cali-OUTPUT
-A cali-OUTPUT -m comment --comment "cali:njdnLwYeGqBJyMxW" -j MARK --set-xmark 0x0/0xf0000
-A cali-OUTPUT -m comment --comment "cali:rz86uTUcEZAfFsh7" -j cali-to-host-endpoint
-A cali-OUTPUT -m comment --comment "cali:pN0F5zD0b8yf9W1Z" -m mark --mark 0x10000/0x10000 -j ACCEPT
-A cali-PREROUTING -m comment --comment "cali:XFX5xbM8B9qR10JG" -j MARK --set-xmark 0x0/0xf0000
-A cali-PREROUTING -i cali+ -m comment --comment "cali:EWMPb0zVROM-woQp" -j MARK --set-xmark 0x40000/0x40000
-A cali-PREROUTING -m comment --comment "cali:PWuxTAIaFCtsg5Qa" -m mark --mark 0x40000/0x40000 -j cali-rpf-skip
-A cali-PREROUTING -m comment --comment "cali:fSSbGND7dgyemWU7" -m mark --mark 0x40000/0x40000 -m rpfilter --validmark --invert -j DROP
-A cali-PREROUTING -m comment --comment "cali:ImU0-4Rl2WoOI9Ou" -m mark --mark 0x0/0x40000 -j cali-from-host-endpoint
-A cali-PREROUTING -m comment --comment "cali:lV4V2MPoMBf0hl9T" -m mark --mark 0x10000/0x10000 -j ACCEPT
COMMIT
# Completed on Thu Oct 20 15:21:33 2022
# Generated by iptables-save v1.8.7 on Thu Oct 20 15:21:33 2022
*mangle
:PREROUTING ACCEPT [6698:444048]
:INPUT ACCEPT [102172:270795908]
:FORWARD ACCEPT [2174:123106]
:OUTPUT ACCEPT [104325:23954924]
:POSTROUTING ACCEPT [106573:24082281]
:KUBE-IPTABLES-HINT - [0:0]
:KUBE-KUBELET-CANARY - [0:0]
:KUBE-PROXY-CANARY - [0:0]
:cali-POSTROUTING - [0:0]
:cali-PREROUTING - [0:0]
:cali-from-host-endpoint - [0:0]
:cali-to-host-endpoint - [0:0]
-A PREROUTING -m comment --comment "cali:6gwbT8clXdHdC1b1" -j cali-PREROUTING
-A POSTROUTING -m comment --comment "cali:O3lYWMrLQYEMJtB5" -j cali-POSTROUTING
-A cali-POSTROUTING -m comment --comment "cali:NX-7roTexQ3fGRfU" -m mark --mark 0x10000/0x10000 -j RETURN
-A cali-POSTROUTING -m comment --comment "cali:nnqPh8lh2VOogSzX" -j MARK --set-xmark 0x0/0xf0000
-A cali-POSTROUTING -m comment --comment "cali:nquN8Jw8Tz72pcBW" -m conntrack --ctstate DNAT -j cali-to-host-endpoint
-A cali-POSTROUTING -m comment --comment "cali:jWrgvDQ0xEZHmta3" -m comment --comment "Host endpoint policy accepted packet." -m mark --mark 0x10000/0x10000 -j RETURN
-A cali-PREROUTING -m comment --comment "cali:6BJqBjBC7crtA-7-" -m conntrack --ctstate RELATED,ESTABLISHED -j ACCEPT
-A cali-PREROUTING -m comment --comment "cali:KX7AGNd6rMcDUai6" -m mark --mark 0x10000/0x10000 -j ACCEPT
-A cali-PREROUTING -m comment --comment "cali:wNH7KsA3ILKJBsY9" -j cali-from-host-endpoint
-A cali-PREROUTING -m comment --comment "cali:Cg96MgVuoPm7UMRo" -m comment --comment "Host endpoint policy accepted packet." -m mark --mark 0x10000/0x10000 -j ACCEPT
COMMIT
# Completed on Thu Oct 20 15:21:33 2022
# Generated by iptables-save v1.8.7 on Thu Oct 20 15:21:33 2022
*nat
:PREROUTING ACCEPT [4503:285688]
:INPUT ACCEPT [2423:185249]
:OUTPUT ACCEPT [874:53673]
:POSTROUTING ACCEPT [913:55144]
:KUBE-KUBELET-CANARY - [0:0]
:KUBE-MARK-DROP - [0:0]
:KUBE-MARK-MASQ - [0:0]
:KUBE-NODEPORTS - [0:0]
:KUBE-POSTROUTING - [0:0]
:KUBE-PROXY-CANARY - [0:0]
:KUBE-SEP-6A3JVU7OXTZFULF3 - [0:0]
:KUBE-SEP-BCU63GGYA77UKS6G - [0:0]
:KUBE-SEP-C7BXNNASKDOC4VRI - [0:0]
:KUBE-SEP-M455ESJZ7M7PMQNS - [0:0]
:KUBE-SEP-PFLOP6O7EUMMJRWB - [0:0]
:KUBE-SEP-UC7HUN6T2VP7U2SX - [0:0]
:KUBE-SERVICES - [0:0]
:KUBE-SVC-ERIFXISQEP7F7OF4 - [0:0]
:KUBE-SVC-JD5MR3NA4I4DYORP - [0:0]
:KUBE-SVC-NPX46M4PTMTKRN6Y - [0:0]
:KUBE-SVC-TCOU7JCQXEZGVUNU - [0:0]
:cali-OUTPUT - [0:0]
:cali-POSTROUTING - [0:0]
:cali-PREROUTING - [0:0]
:cali-fip-dnat - [0:0]
:cali-fip-snat - [0:0]
:cali-nat-outgoing - [0:0]
-A PREROUTING -m comment --comment "cali:6gwbT8clXdHdC1b1" -j cali-PREROUTING
-A PREROUTING -m comment --comment "kubernetes service portals" -j KUBE-SERVICES
-A OUTPUT -m comment --comment "cali:tVnHkvAo15HuiPy0" -j cali-OUTPUT
-A OUTPUT -m comment --comment "kubernetes service portals" -j KUBE-SERVICES
-A POSTROUTING -m comment --comment "cali:O3lYWMrLQYEMJtB5" -j cali-POSTROUTING
-A POSTROUTING -m comment --comment "kubernetes postrouting rules" -j KUBE-POSTROUTING
-A KUBE-MARK-DROP -j MARK --set-xmark 0x8000/0x8000
-A KUBE-MARK-MASQ -j MARK --set-xmark 0x4000/0x4000
-A KUBE-POSTROUTING -m mark ! --mark 0x4000/0x4000 -j RETURN
-A KUBE-POSTROUTING -j MARK --set-xmark 0x4000/0x0
-A KUBE-POSTROUTING -m comment --comment "kubernetes service traffic requiring SNAT" -j MASQUERADE --random-fully
-A KUBE-SEP-6A3JVU7OXTZFULF3 -s 172.17.0.2/32 -m comment --comment "default/kubernetes:https" -j KUBE-MARK-MASQ
-A KUBE-SEP-6A3JVU7OXTZFULF3 -p tcp -m comment --comment "default/kubernetes:https" -m tcp -j DNAT --to-destination 172.17.0.2:16443
-A KUBE-SEP-BCU63GGYA77UKS6G -s 10.1.230.1/32 -m comment --comment "kube-system/kube-dns:metrics" -j KUBE-MARK-MASQ
-A KUBE-SEP-BCU63GGYA77UKS6G -p tcp -m comment --comment "kube-system/kube-dns:metrics" -m tcp -j DNAT --to-destination 10.1.230.1:9153
-A KUBE-SEP-C7BXNNASKDOC4VRI -s 172.17.0.3/32 -m comment --comment "default/kubernetes:https" -j KUBE-MARK-MASQ
-A KUBE-SEP-C7BXNNASKDOC4VRI -p tcp -m comment --comment "default/kubernetes:https" -m tcp -j DNAT --to-destination 172.17.0.3:16443
-A KUBE-SEP-M455ESJZ7M7PMQNS -s 10.1.230.1/32 -m comment --comment "kube-system/kube-dns:dns-tcp" -j KUBE-MARK-MASQ
-A KUBE-SEP-M455ESJZ7M7PMQNS -p tcp -m comment --comment "kube-system/kube-dns:dns-tcp" -m tcp -j DNAT --to-destination 10.1.230.1:53
-A KUBE-SEP-PFLOP6O7EUMMJRWB -s 10.1.230.1/32 -m comment --comment "kube-system/kube-dns:dns" -j KUBE-MARK-MASQ
-A KUBE-SEP-PFLOP6O7EUMMJRWB -p udp -m comment --comment "kube-system/kube-dns:dns" -m udp -j DNAT --to-destination 10.1.230.1:53
-A KUBE-SEP-UC7HUN6T2VP7U2SX -s 172.17.0.1/32 -m comment --comment "default/kubernetes:https" -j KUBE-MARK-MASQ
-A KUBE-SEP-UC7HUN6T2VP7U2SX -p tcp -m comment --comment "default/kubernetes:https" -m tcp -j DNAT --to-destination 172.17.0.1:16443
-A KUBE-SERVICES -d 10.152.183.1/32 -p tcp -m comment --comment "default/kubernetes:https cluster IP" -m tcp --dport 443 -j KUBE-SVC-NPX46M4PTMTKRN6Y
-A KUBE-SERVICES -d 10.152.183.10/32 -p tcp -m comment --comment "kube-system/kube-dns:dns-tcp cluster IP" -m tcp --dport 53 -j KUBE-SVC-ERIFXISQEP7F7OF4
-A KUBE-SERVICES -d 10.152.183.10/32 -p tcp -m comment --comment "kube-system/kube-dns:metrics cluster IP" -m tcp --dport 9153 -j KUBE-SVC-JD5MR3NA4I4DYORP
-A KUBE-SERVICES -d 10.152.183.10/32 -p udp -m comment --comment "kube-system/kube-dns:dns cluster IP" -m udp --dport 53 -j KUBE-SVC-TCOU7JCQXEZGVUNU
-A KUBE-SERVICES -m comment --comment "kubernetes service nodeports; NOTE: this must be the last rule in this chain" -m addrtype --dst-type LOCAL -j KUBE-NODEPORTS
-A KUBE-SVC-ERIFXISQEP7F7OF4 ! -s 10.1.0.0/16 -d 10.152.183.10/32 -p tcp -m comment --comment "kube-system/kube-dns:dns-tcp cluster IP" -m tcp --dport 53 -j KUBE-MARK-MASQ
-A KUBE-SVC-ERIFXISQEP7F7OF4 -m comment --comment "kube-system/kube-dns:dns-tcp -> 10.1.230.1:53" -j KUBE-SEP-M455ESJZ7M7PMQNS
-A KUBE-SVC-JD5MR3NA4I4DYORP ! -s 10.1.0.0/16 -d 10.152.183.10/32 -p tcp -m comment --comment "kube-system/kube-dns:metrics cluster IP" -m tcp --dport 9153 -j KUBE-MARK-MASQ
-A KUBE-SVC-JD5MR3NA4I4DYORP -m comment --comment "kube-system/kube-dns:metrics -> 10.1.230.1:9153" -j KUBE-SEP-BCU63GGYA77UKS6G
-A KUBE-SVC-NPX46M4PTMTKRN6Y ! -s 10.1.0.0/16 -d 10.152.183.1/32 -p tcp -m comment --comment "default/kubernetes:https cluster IP" -m tcp --dport 443 -j KUBE-MARK-MASQ
-A KUBE-SVC-NPX46M4PTMTKRN6Y -m comment --comment "default/kubernetes:https -> 172.17.0.1:16443" -m statistic --mode random --probability 0.33333333349 -j KUBE-SEP-UC7HUN6T2VP7U2SX
-A KUBE-SVC-NPX46M4PTMTKRN6Y -m comment --comment "default/kubernetes:https -> 172.17.0.2:16443" -m statistic --mode random --probability 0.50000000000 -j KUBE-SEP-6A3JVU7OXTZFULF3
-A KUBE-SVC-NPX46M4PTMTKRN6Y -m comment --comment "default/kubernetes:https -> 172.17.0.3:16443" -j KUBE-SEP-C7BXNNASKDOC4VRI
-A KUBE-SVC-TCOU7JCQXEZGVUNU ! -s 10.1.0.0/16 -d 10.152.183.10/32 -p udp -m comment --comment "kube-system/kube-dns:dns cluster IP" -m udp --dport 53 -j KUBE-MARK-MASQ
-A KUBE-SVC-TCOU7JCQXEZGVUNU -m comment --comment "kube-system/kube-dns:dns -> 10.1.230.1:53" -j KUBE-SEP-PFLOP6O7EUMMJRWB
-A cali-OUTPUT -m comment --comment "cali:GBTAv2p5CwevEyJm" -j cali-fip-dnat
-A cali-POSTROUTING -m comment --comment "cali:Z-c7XtVd2Bq7s_hA" -j cali-fip-snat
-A cali-POSTROUTING -m comment --comment "cali:nYKhEzDlr11Jccal" -j cali-nat-outgoing
-A cali-POSTROUTING -o vxlan.calico -m comment --comment "cali:e9dnSgSVNmIcpVhP" -m addrtype ! --src-type LOCAL --limit-iface-out -m addrtype --src-type LOCAL -j MASQUERADE --random-fully
-A cali-PREROUTING -m comment --comment "cali:r6XmIziWUJsdOK6Z" -j cali-fip-dnat
-A cali-nat-outgoing -m comment --comment "cali:flqWnvo8yq4ULQLa" -m set --match-set cali40masq-ipam-pools src -m set ! --match-set cali40all-ipam-pools dst -j MASQUERADE --random-fully
COMMIT
# Completed on Thu Oct 20 15:21:33 2022
# Generated by iptables-save v1.8.7 on Thu Oct 20 15:21:33 2022
*filter
:INPUT ACCEPT [65193:118040782]
:FORWARD ACCEPT [0:0]
:OUTPUT ACCEPT [69883:14247790]
:KUBE-EXTERNAL-SERVICES - [0:0]
:KUBE-FIREWALL - [0:0]
:KUBE-FORWARD - [0:0]
:KUBE-KUBELET-CANARY - [0:0]
:KUBE-NODEPORTS - [0:0]
:KUBE-PROXY-CANARY - [0:0]
:KUBE-PROXY-FIREWALL - [0:0]
:KUBE-SERVICES - [0:0]
:cali-FORWARD - [0:0]
:cali-INPUT - [0:0]
:cali-OUTPUT - [0:0]
:cali-cidr-block - [0:0]
:cali-from-hep-forward - [0:0]
:cali-from-host-endpoint - [0:0]
:cali-from-wl-dispatch - [0:0]
:cali-fw-cali7facf2bb570 - [0:0]
:cali-pri-_u2Tn2rSoAPffvE7JO6 - [0:0]
:cali-pri-kns.kube-system - [0:0]
:cali-pro-_u2Tn2rSoAPffvE7JO6 - [0:0]
:cali-pro-kns.kube-system - [0:0]
:cali-to-hep-forward - [0:0]
:cali-to-host-endpoint - [0:0]
:cali-to-wl-dispatch - [0:0]
:cali-tw-cali7facf2bb570 - [0:0]
:cali-wl-to-host - [0:0]
-A INPUT -m comment --comment "cali:Cz_u1IQiXIMmKD4c" -j cali-INPUT
-A INPUT -m conntrack --ctstate NEW -m comment --comment "kubernetes load balancer firewall" -j KUBE-PROXY-FIREWALL
-A INPUT -m comment --comment "kubernetes health check service ports" -j KUBE-NODEPORTS
-A INPUT -m conntrack --ctstate NEW -m comment --comment "kubernetes externally-visible service portals" -j KUBE-EXTERNAL-SERVICES
-A INPUT -j KUBE-FIREWALL
-A FORWARD -m comment --comment "cali:wUHhoiAYhphO9Mso" -j cali-FORWARD
-A FORWARD -m conntrack --ctstate NEW -m comment --comment "kubernetes load balancer firewall" -j KUBE-PROXY-FIREWALL
-A FORWARD -m comment --comment "kubernetes forwarding rules" -j KUBE-FORWARD
-A FORWARD -m conntrack --ctstate NEW -m comment --comment "kubernetes service portals" -j KUBE-SERVICES
-A FORWARD -m conntrack --ctstate NEW -m comment --comment "kubernetes externally-visible service portals" -j KUBE-EXTERNAL-SERVICES
-A FORWARD -s 10.1.0.0/16 -m comment --comment "generated for MicroK8s pods" -j ACCEPT
-A FORWARD -d 10.1.0.0/16 -m comment --comment "generated for MicroK8s pods" -j ACCEPT
-A FORWARD -m comment --comment "cali:S93hcgKJrXEqnTfs" -m comment --comment "Policy explicitly accepted packet." -m mark --mark 0x10000/0x10000 -j ACCEPT
-A FORWARD -m comment --comment "cali:mp77cMpurHhyjLrM" -j MARK --set-xmark 0x10000/0x10000
-A OUTPUT -m comment --comment "cali:tVnHkvAo15HuiPy0" -j cali-OUTPUT
-A OUTPUT -m conntrack --ctstate NEW -m comment --comment "kubernetes load balancer firewall" -j KUBE-PROXY-FIREWALL
-A OUTPUT -m conntrack --ctstate NEW -m comment --comment "kubernetes service portals" -j KUBE-SERVICES
-A OUTPUT -j KUBE-FIREWALL
-A KUBE-FIREWALL ! -s 127.0.0.0/8 -d 127.0.0.0/8 -m comment --comment "block incoming localnet connections" -m conntrack ! --ctstate RELATED,ESTABLISHED,DNAT -j DROP
-A KUBE-FIREWALL -m comment --comment "kubernetes firewall for dropping marked packets" -m mark --mark 0x8000/0x8000 -j DROP
-A KUBE-FORWARD -m conntrack --ctstate INVALID -j DROP
-A KUBE-FORWARD -m comment --comment "kubernetes forwarding rules" -m mark --mark 0x4000/0x4000 -j ACCEPT
-A KUBE-FORWARD -m comment --comment "kubernetes forwarding conntrack rule" -m conntrack --ctstate RELATED,ESTABLISHED -j ACCEPT
-A cali-FORWARD -m comment --comment "cali:vjrMJCRpqwy5oRoX" -j MARK --set-xmark 0x0/0xe0000
-A cali-FORWARD -m comment --comment "cali:A_sPAO0mcxbT9mOV" -m mark --mark 0x0/0x10000 -j cali-from-hep-forward
-A cali-FORWARD -i cali+ -m comment --comment "cali:8ZoYfO5HKXWbB3pk" -j cali-from-wl-dispatch
-A cali-FORWARD -o cali+ -m comment --comment "cali:jdEuaPBe14V2hutn" -j cali-to-wl-dispatch
-A cali-FORWARD -m comment --comment "cali:12bc6HljsMKsmfr-" -j cali-to-hep-forward
-A cali-FORWARD -m comment --comment "cali:NOSxoaGx8OIstr1z" -j cali-cidr-block
-A cali-INPUT -p udp -m comment --comment "cali:MYAij0dXtIVCOZ-i" -m comment --comment "Allow IPv4 VXLAN packets from whitelisted hosts" -m multiport --dports 4789 -m set --match-set cali40all-vxlan-net src -m addrtype --dst-type LOCAL -j ACCEPT
-A cali-INPUT -p udp -m comment --comment "cali:c3JpWekSTKWcdGH0" -m comment --comment "Drop IPv4 VXLAN packets from non-whitelisted hosts" -m multiport --dports 4789 -m addrtype --dst-type LOCAL -j DROP
-A cali-INPUT -i cali+ -m comment --comment "cali:GHNQrv7E2G0IJEfW" -g cali-wl-to-host
-A cali-INPUT -m comment --comment "cali:6YzZ8qcOgyIR5ppt" -m mark --mark 0x10000/0x10000 -j ACCEPT
-A cali-INPUT -m comment --comment "cali:qOd2K55HtgxOGlyU" -j MARK --set-xmark 0x0/0xf0000
-A cali-INPUT -m comment --comment "cali:6TxvWLlvB6fxnMSK" -j cali-from-host-endpoint
-A cali-INPUT -m comment --comment "cali:PdJ_Zff0LZsWxU3J" -m comment --comment "Host endpoint policy accepted packet." -m mark --mark 0x10000/0x10000 -j ACCEPT
-A cali-OUTPUT -m comment --comment "cali:Mq1_rAdXXH3YkrzW" -m mark --mark 0x10000/0x10000 -j ACCEPT
-A cali-OUTPUT -o cali+ -m comment --comment "cali:69FkRTJDvD5Vu6Vl" -j RETURN
-A cali-OUTPUT -p udp -m comment --comment "cali:gPT-T3DOftxv-f7s" -m comment --comment "Allow IPv4 VXLAN packets to other whitelisted hosts" -m multiport --dports 4789 -m addrtype --src-type LOCAL -m set --match-set cali40all-vxlan-net dst -j ACCEPT
-A cali-OUTPUT -m comment --comment "cali:34nnaqt4jugdpnGN" -j MARK --set-xmark 0x0/0xf0000
-A cali-OUTPUT -m comment --comment "cali:W4QqZRKKV2oMJ3jj" -m conntrack ! --ctstate DNAT -j cali-to-host-endpoint
-A cali-OUTPUT -m comment --comment "cali:gZWowMovk9jHGpOx" -m comment --comment "Host endpoint policy accepted packet." -m mark --mark 0x10000/0x10000 -j ACCEPT
-A cali-from-wl-dispatch -i cali7facf2bb570 -m comment --comment "cali:_eWlHt0MYS0AJrXD" -g cali-fw-cali7facf2bb570
-A cali-from-wl-dispatch -m comment --comment "cali:fmehsw_jzEA5Cb_s" -m comment --comment "Unknown interface" -j DROP
-A cali-fw-cali7facf2bb570 -m comment --comment "cali:ZL4oX0icsuhMPMhu" -m conntrack --ctstate RELATED,ESTABLISHED -j ACCEPT
-A cali-fw-cali7facf2bb570 -m comment --comment "cali:TGUt3bRqGe3E_pB2" -m conntrack --ctstate INVALID -j DROP
-A cali-fw-cali7facf2bb570 -m comment --comment "cali:G8N8M3lBvWCR7bh_" -j MARK --set-xmark 0x0/0x10000
-A cali-fw-cali7facf2bb570 -p udp -m comment --comment "cali:KepBo-NpdWEyF0HL" -m comment --comment "Drop VXLAN encapped packets originating in workloads" -m multiport --dports 4789 -j DROP
-A cali-fw-cali7facf2bb570 -p ipencap -m comment --comment "cali:BrbsafqVtq2atV4z" -m comment --comment "Drop IPinIP encapped packets originating in workloads" -j DROP
-A cali-fw-cali7facf2bb570 -m comment --comment "cali:4Nx2whFKgeWsYTHa" -j cali-pro-kns.kube-system
-A cali-fw-cali7facf2bb570 -m comment --comment "cali:VRemOUgYv7IoD73F" -m comment --comment "Return if profile accepted" -m mark --mark 0x10000/0x10000 -j RETURN
-A cali-fw-cali7facf2bb570 -m comment --comment "cali:uySSANK3XrGgUR2E" -j cali-pro-_u2Tn2rSoAPffvE7JO6
-A cali-fw-cali7facf2bb570 -m comment --comment "cali:rWfz4ofkuAx_AbaF" -m comment --comment "Return if profile accepted" -m mark --mark 0x10000/0x10000 -j RETURN
-A cali-fw-cali7facf2bb570 -m comment --comment "cali:CJG3YcfS9bBB0DF3" -m comment --comment "Drop if no profiles matched" -j DROP
-A cali-pri-_u2Tn2rSoAPffvE7JO6 -m comment --comment "cali:WqgznqAQ-uYV0oBx" -m comment --comment "Profile ksa.kube-system.coredns ingress"
-A cali-pri-kns.kube-system -m comment --comment "cali:J1TyxtHWd0qaBGK-" -m comment --comment "Profile kns.kube-system ingress" -j MARK --set-xmark 0x10000/0x10000
-A cali-pri-kns.kube-system -m comment --comment "cali:QIB6k7eEKdIg73Jp" -m mark --mark 0x10000/0x10000 -j RETURN
-A cali-pro-_u2Tn2rSoAPffvE7JO6 -m comment --comment "cali:0-_UPh39dt5XfhmJ" -m comment --comment "Profile ksa.kube-system.coredns egress"
-A cali-pro-kns.kube-system -m comment --comment "cali:tgOR2S8DVHZW3F1M" -m comment --comment "Profile kns.kube-system egress" -j MARK --set-xmark 0x10000/0x10000
-A cali-pro-kns.kube-system -m comment --comment "cali:HVEEtYPJsiGRXCIt" -m mark --mark 0x10000/0x10000 -j RETURN
-A cali-to-wl-dispatch -o cali7facf2bb570 -m comment --comment "cali:8XdsySiyzpJeg5pE" -g cali-tw-cali7facf2bb570
-A cali-to-wl-dispatch -m comment --comment "cali:yxcLw8L3E5-XOnmJ" -m comment --comment "Unknown interface" -j DROP
-A cali-tw-cali7facf2bb570 -m comment --comment "cali:qY0lsNAWMKXY3w59" -m conntrack --ctstate RELATED,ESTABLISHED -j ACCEPT
-A cali-tw-cali7facf2bb570 -m comment --comment "cali:BC5NVZXXBeiwltlB" -m conntrack --ctstate INVALID -j DROP
-A cali-tw-cali7facf2bb570 -m comment --comment "cali:wyoCItlmpdneC-k5" -j MARK --set-xmark 0x0/0x10000
-A cali-tw-cali7facf2bb570 -m comment --comment "cali:Xvb_xGWXkt7nnVK-" -j cali-pri-kns.kube-system
-A cali-tw-cali7facf2bb570 -m comment --comment "cali:WMUv5J-3WSq6Y0mK" -m comment --comment "Return if profile accepted" -m mark --mark 0x10000/0x10000 -j RETURN
-A cali-tw-cali7facf2bb570 -m comment --comment "cali:Ibc9Ur6qqd-qk9z8" -j cali-pri-_u2Tn2rSoAPffvE7JO6
-A cali-tw-cali7facf2bb570 -m comment --comment "cali:AMAT-0qYFKf2O8kT" -m comment --comment "Return if profile accepted" -m mark --mark 0x10000/0x10000 -j RETURN
-A cali-tw-cali7facf2bb570 -m comment --comment "cali:3SJV7xJzkDy3riH7" -m comment --comment "Drop if no profiles matched" -j DROP
-A cali-wl-to-host -m comment --comment "cali:Ee9Sbo10IpVujdIY" -j cali-from-wl-dispatch
-A cali-wl-to-host -m comment --comment "cali:nSZbcOoG1xPONxb8" -m comment --comment "Configured DefaultEndpointToHostAction" -j ACCEPT
COMMIT
# Completed on Thu Oct 20 15:21:33 2022

ipset list

Name: cali40all-ipam-pools
Type: hash:net
Revision: 7
Header: family inet hashsize 1024 maxelem 1048576 bucketsize 12 initval 0x48cb23c4
Size in memory: 504
References: 1
Number of entries: 1
Members:
10.1.0.0/16

Name: cali40masq-ipam-pools
Type: hash:net
Revision: 7
Header: family inet hashsize 1024 maxelem 1048576 bucketsize 12 initval 0x8d040052
Size in memory: 504
References: 1
Number of entries: 1
Members:
10.1.0.0/16

Name: cali40this-host
Type: hash:ip
Revision: 5
Header: family inet hashsize 1024 maxelem 1048576 bucketsize 12 initval 0x94503a88
Size in memory: 440
References: 0
Number of entries: 6
Members:
127.0.0.1
172.17.0.2
10.1.230.0
172.17.16.2
172.24.0.2
127.0.0.0

Name: cali40all-vxlan-net
Type: hash:net
Revision: 7
Header: family inet hashsize 1024 maxelem 1048576 bucketsize 12 initval 0x2a01fcfc
Size in memory: 552
References: 2
Number of entries: 2
Members:
172.17.0.3
172.17.0.1

**Comment by neoaggelos** [comment]
Hi @masato-yoshi-dnsalias-com 

We have seen some issues with VXLAN overlay networks due to a known kernel bug with computing checksums. Can you see what the output of `ethtool --show-offload vxlan.calico | grep checksum` and `microk8s kubectl get felixconfigurations -o yaml`?

**Comment by masato-yoshi-dnsalias-com** [comment]
Information is below.

ethtool --show-offload vxlan.calico | grep checksum
rx-checksumming: on
tx-checksumming: on
        tx-checksum-ipv4: off [fixed]
        tx-checksum-ip-generic: on
        tx-checksum-ipv6: off [fixed]
        tx-checksum-fcoe-crc: off [fixed]
        tx-checksum-sctp: off [fixed]

microk8s kubectl get felixconfigurations -o yaml
apiVersion: v1
items:
- apiVersion: crd.projectcalico.org/v1
  kind: FelixConfiguration
  metadata:
    annotations:
      projectcalico.org/metadata: '{"uid":"c62e7fc3-b917-43ab-a335-ec0be4789aee","creationTimestamp":"2022-10-21T04:49:38Z"}'
    creationTimestamp: "2022-10-21T04:49:38Z"
    generation: 2
    name: default
    resourceVersion: "665"
    uid: c62e7fc3-b917-43ab-a335-ec0be4789aee
  spec:
    bpfLogLevel: ""
    disableConntrackInvalidCheck: true
    logSeverityScreen: Info
    reportingInterval: 0s
    vxlanEnabled: true
kind: List
metadata:
  resourceVersion: ""

**Comment by masato-yoshi-dnsalias-com** [comment]
It will work if you add the CIDR (--service-cluster-ip-range) for the kubernetes service to the routing table.

ip route add 172.29.0.0/17 dev vxlan.calico

**Comment by masato-yoshi-dnsalias-com** [comment]
Thank you.
You can now communicate with the command below.
However, I want the kernel to be fixed because I can't type commands until I start microk8s.

ethtool -K vxlan.calico tx off

**Comment by neoaggelos** [comment]
@masato-yoshi-dnsalias-com Were you able to fix the issue using these commands?

Can you see if Calico works out the offloading itself by doing:

```
microk8s patch felixconfigurations default --patch '{"spec":{"featureDetectOverride":"ChecksumOffloadBroken=true"}}' --type=merge
```

This should configure the offload for the vxlan.calico interface on all cluster nodes.

**Comment by masato-yoshi-dnsalias-com** [comment]
Thank you.
Communication was possible normally under the following conditions.

kubectl exec -it -n kube-system calicoctl -- calicoctl get felixconfigurations default -o yaml

apiVersion: projectcalico.org/v3
kind: FelixConfiguration
metadata:
  creationTimestamp: "2022-10-21T12:46:41Z"
  name: default
  resourceVersion: "87916"
  uid: 012163da-c10a-4941-a9e0-6b886c079940
spec:
  bpfLogLevel: ""
  disableConntrackInvalidCheck: true
  featureDetectOverride: ChecksumOffloadBroken=true
  logSeverityScreen: Info
  reportingInterval: 0s
  vxlanEnabled: true

**Comment by chunkypewpew** [comment]
Ran into the same problem while figuring out why cert-manager with letsencrypt doesn't work in a cluster environment (clusterissuer would stuck at trying to resolve acme-v02.api.letsencrypt.org using dns01 challenge)

Confirmed that the workaround works!

Thanks a lot!
