### ISSUE TITLE
cert-manager is not working in high-availability setup

### ISSUE THREAD

**Issue by jsemohub** [canonical/microk8s#3657]
#### Summary

Once host-access is enabled on all cluster nodes.
Cert-manager webhook stops working and `ClusterIssuer `is no longer creating signed certificates. 
 Cert manager webhook is reporting the following errors in the log
```
I0110 03:15:04.838270       1 logs.go:59] http: TLS handshake error from 10.0.1.1:48432: EOF
I0110 03:18:38.022361       1 logs.go:59] http: TLS handshake error from 10.0.1.1:63331: EOF
I0110 03:39:31.676663       1 logs.go:59] http: TLS handshake error from 10.0.1.1:1688: read tcp 10.1.150.9:10250->10.0.1.1:1688: read: connection reset by peer
I0110 03:39:31.686002       1 logs.go:59] http: TLS handshake error from 10.0.1.1:1192: EOF

```

#### What Should Happen Instead?

Signed certificated should be created by `ClusterIssuer `without any errors.

#### Reproduction Steps

1. ...
2. ...

#### Can you suggest a fix?

Not at the moment. high-availability setup is quite a bit flaky.

#### Are you interested in contributing with a fix?

I will share details if I find a workaround solution.
It would be awesome if somebody could help though.

**Comment by jsemohub** [comment]
Here are some additional details
1. Cert-manager api is not reachable 
```
cmctl check api
Not ready: Internal error occurred: failed calling webhook "webhook.cert-manager.io": failed to call webhook: Post "https://cert-manager-webhook.cert-manager.svc:443/mutate?timeout=10s": context deadline exceeded

```
2. When I add `.cluster.local`, I can lookup the service as in
```
nslookup cert-manager-webhook.cert-manager.svc.cluster.local
Server:         10.152.183.10
Address:        10.152.183.10#53

Name:   cert-manager-webhook.cert-manager.svc.cluster.local
Address: 10.152.183.141

/
❯ nslookup cert-manager-webhook.cert-manager.svc
Server:         10.152.183.10
Address:        10.152.183.10#53

** server can't find cert-manager-webhook.cert-manager.svc: NXDOMAIN
/
❯ cat /etc/resolv.conf
nameserver 10.152.183.10
options ndots:5
```

Unsure if the above setup is expected.

**Comment by jsemohub** [comment]
Service dns lookup works on one node and fails on the others
```
kubectl exec -it net-tools -- nslookup cert-manager-webhook.cert-manager.svc
Server:         10.152.183.10
Address:        10.152.183.10#53

Name:   cert-manager-webhook.cert-manager.svc.cluster.local
Address: 10.152.183.141

kubectl exec -it net-tools-1 -- nslookup cert-manager-webhook.cert-manager.svc
Server:         10.152.183.10
Address:        10.152.183.10#53

** server can't find cert-manager-webhook.cert-manager.svc: NXDOMAIN
command terminated with exit code 1

kubectl exec -it net-tools-2 -- nslookup cert-manager-webhook.cert-manager.svc
Server:         10.152.183.10
Address:        10.152.183.10#53

** server can't find cert-manager-webhook.cert-manager.svc: NXDOMAIN
command terminated with exit code 1
```

**Comment by berkayoz** [comment]
Hey @jsemohub, 

Could you provide some more info on your current setup? How many and which type of nodes are there? Are you using the default IP address `10.0.1.1` on the `host-access` addon on every node? Could you also provide an inspection report tarball?

Thank you.

**Comment by jsemohub** [comment]
Hi @berkayoz,
In summary, I am currently configuring 3 nodes - all part of high-availability (master nodes) group.

Before we look at report tarball, could we take a quick peek at the differences below?

Two of the nodes have 3 NIC cards, and the other one just 2 NIC cards.
I think I found some differences that ma give us some clues.
I am running shell on an image deployed to 3 nodes.
 kubectl exec -it -n default net-tools-X -- bash, where X is 1,2,3

On the one with 2 NIC cards has extra search line
```
cat /etc/resolv.conf
search default.svc.cluster.local svc.cluster.local cluster.local
nameserver 10.152.183.10
options ndots:5
```
vs same cat on the other two
```
cat /etc/resolv.conf
nameserver 10.152.183.10
options ndots:5

```
Could that be the culprit? If yes, how do we fix it?

**Comment by berkayoz** [comment]
Hey,
I don't believe there is any reason to change the default `10.0.1.1` address for every node, as it's just added as a loopback address. Although could you set it to a different one maybe something with `192.x.x.x` to see if that changes anything.

For your findings, I'd expect all pods to have more or less the same `resolv.conf`. This might be a culprit, but maybe not by itself since the issue starts after enabling host-access which leads me to believe there might be something behind the `resolv.conf` difference if so. I'm also assuming `dns` is enabled right?

Thanks.

**Comment by jsemohub** [comment]
Yes. `DNS `is enabled. How come though `/etc/recolve.conf` on k8s pods are different while local `/etc/resolve.conf` and [/run/systemd/resolve/resolv.conf](url) are the same on all three nodes?

**Comment by berkayoz** [comment]
Well, kubelet manages the `/etc/resolve.conf` in pods so I'm not entirely certain on how. It might be that there is a communication issue with `coredns` that leads up to this. These are all just theories which might not be true, I can't say much without looking into more logs.

**Comment by jsemohub** [comment]
[inspection-report-20230110_130136.tar.gz](https://github.com/canonical/microk8s/files/10385631/inspection-report-20230110_130136.tar.gz)

Please find inspection report attached.

**Comment by jsemohub** [comment]
Is cluster dump at `./k8s/cluster-info` the file to look at first?

**Comment by berkayoz** [comment]
Thank you for attaching the inspection report. Each tarball contains node specific information as well, so the inspection report form one of the nodes with the issue would be the best.

For starters, looking at the `cluster-info-dump` to see logs and events is a step. Next one would be looking at `kubelite` journal log. I'll spend some time reading through these and will keep you updated.

**Comment by jsemohub** [comment]
If I change host-access ip to  `192.x.x.x` as you suggested earlier, I am still getting an error
`http: TLS handshake error from 192.168.3.1:57779: EOF`

**Comment by jsemohub** [comment]
I added `--cluster-domain=cluster.local` to` /var/snap/microk8s/current/args/kubelet`.
I didn't solve the main issuer with webhook but at least it resolved differences with `/etc/resolve.conf `I mentioned above.

Now all nslookup calls work
```
kubectl exec -it net-tools -- nslookup cert-manager-webhook.cert-manager.svc
Server:         10.152.183.10
Address:        10.152.183.10#53

Name:   cert-manager-webhook.cert-manager.svc.cluster.local
Address: 10.152.183.141

kubectl exec -it net-tools-1 -- nslookup cert-manager-webhook.cert-manager.svc
Server:         10.152.183.10
Address:        10.152.183.10#53

Name:   cert-manager-webhook.cert-manager.svc.cluster.local
Address: 10.152.183.141

kubectl exec -it net-tools-2 -- nslookup cert-manager-webhook.cert-manager.svc
Server:         10.152.183.10
Address:        10.152.183.10#53

Name:   cert-manager-webhook.cert-manager.svc.cluster.local
Address: 10.152.183.141

```
however still call to webhook ctl fails
```
cmctl check api
Not ready: Internal error occurred: failed calling webhook "webhook.cert-manager.io": failed to call webhook: Post "https://cert-manager-webhook.cert-manager.svc:443/mutate?timeout=10s": dial tcp 10.152.183.141:443: i/o timeout

```

**Comment by jsemohub** [comment]
I am suspecting host-access plugin is not the root of the issue here.

**Comment by jsemohub** [comment]
yes. I switched to 192.168.3.1 as per your recommendation.
I can confirm it doesn't work when I disable host-access. It fails with same error just different ip.

**Comment by jsemohub** [comment]
cert-manager         pod/cert-manager-webhook-76779fd489-tvscq     1/1     Running   2 (28m ago)    12h
cert-manager         service/cert-manager-webhook   ClusterIP      10.152.183.141   <none>        443/TCP                  3d17h
cert-manager         deployment.apps/cert-manager-webhook      1/1     1            1           3d17h
cert-manager         replicaset.apps/cert-manager-webhook-78665d5b6      0         0         0       13h <-- What is that guy?
cert-manager         replicaset.apps/cert-manager-webhook-76779fd489     1         1         1       12h

**Comment by jsemohub** [comment]
Tried a newer version of cert-manager
kubectl apply -f https://github.com/cert-manager/cert-manager/releases/download/v1.10.2/cert-manager.yaml

The error persists which points to likely issues with a network setup. 
tcpdump and iptables logging would be my last resort. Ugh...

**Comment by jsemohub** [comment]
Tried a fresh helm install
helm install cert-manager --namespace cert-manager --version v1.11.0 jetstack/cert-manager  --set installCRDs=true --set webhook.hostNetwork=true --set webhook.securePort=10260

The problem remains 
` TLS handshake error from 192.168.1.106:43649: EOF`

I collected tcpdump and could track packets captured between ports  43649 and 10260


```
4119	15.372316	192.168.1.129	192.168.1.106	TCP	74	37848 → 10260 [SYN] Seq=0 Win=64240 Len=0 MSS=1460 SACK_PERM=1 TSval=840809102 TSecr=0 WS=128
4120	15.372366	192.168.1.106	192.168.1.129	TCP	74	10260 → 37848 [SYN, ACK] Seq=0 Ack=1 Win=65160 Len=0 MSS=1460 SACK_PERM=1 TSval=2741074256 TSecr=840809102 WS=128
4121	15.372542	192.168.1.129	192.168.1.106	TCP	66	37848 → 10260 [ACK] Seq=1 Ack=1 Win=64256 Len=0 TSval=840809102 TSecr=2741074256
4130	15.373350	192.168.1.129	192.168.1.106	TLSv1.3	366	Client Hello
4131	15.373366	192.168.1.106	192.168.1.129	TCP	66	10260 → 37848 [ACK] Seq=1 Ack=301 Win=64896 Len=0 TSval=2741074257 TSecr=840809103
4137	15.374539	192.168.1.106	192.168.1.129	TLSv1.3	1005	Server Hello, Change Cipher Spec, Application Data, Application Data, Application Data, Application Data
4139	15.374726	192.168.1.129	192.168.1.106	TCP	66	37848 → 10260 [ACK] Seq=301 Ack=940 Win=64128 Len=0 TSval=840809104 TSecr=2741074258
4148	15.376570	192.168.1.129	192.168.1.106	TCP	66	37848 → 10260 [FIN, ACK] Seq=301 Ack=940 Win=64128 Len=0 TSval=840809106 TSecr=2741074258
4149	15.376652	192.168.1.106	192.168.1.129	TCP	66	10260 → 37848 [FIN, ACK] Seq=940 Ack=302 Win=64896 Len=0 TSval=2741074260 TSecr=840809106
4150	15.376832	192.168.1.129	192.168.1.106	TCP	66	37848 → 10260 [ACK] Seq=302 Ack=941 Win=64128 Len=0 TSval=840809106 TSecr=2741074260
```
It doesn't reveal the reason for TSL error. Maybe some iptables NAT-ing issues would be my guess.
On the other hand, testing cert using curl checks out
```
curl -vsS --resolve cert-manager-webhook.cert-manager.svc:10260:127.0.0.1 \
    --service-name cert-manager-webhook-ca \
    --cacert <(kubectl get validatingwebhookconfigurations cert-manager-webhook -ojson | jq '.webhooks[].clientConfig.caBundle' -r | base64 -d) \
    https://cert-manager-webhook.cert-manager.svc:10260/validate 2>&1 -d@- <<'EOF' | sed '/^* /d; /bytes data]$/d; s/> //; s/< //'
{"kind":"AdmissionReview","apiVersion":"admission.k8s.io/v1","request":{"requestKind":{"group":"cert-manager.io","version":"v1","kind":"Certificate"},"requestResource":{"group":"cert-manager.io","version":"v1","resource":"certificates"},"name":"foo","namespace":"default","operation":"CREATE","object":{"apiVersion":"cert-manager.io/v1","kind":"Certificate","spec":{"dnsNames":["foo"],"issuerRef":{"group":"cert-manager.io","kind":"Issuer","name":"letsencrypt"},"secretName":"foo","usages":["digital signature"]}}}}
EOF
```
Any help would be very really welcome right now:).

**Comment by jsemohub** [comment]
I tried to add logging
```
iptables -I cali-to-wl-dispatch 5 -j LOG --log-prefix "IPTables-Dropped {cali-to-wl-dispatch} {5}: " --log-level 4

iptables -I cali-to-wl-dispatch-6 3 -j LOG --log-prefix "IPTables-Dropped {cali-to-wl-dispatch-6} {3}: " --log-level 4

iptables -I cali-tw-cali0ded612e6fa 2 -j LOG --log-prefix "IPTables-Dropped {cali-tw-cali0ded612e6fa} {2}: " --log-level 4
iptables -I cali-tw-cali0ded612e6fa 9 -j LOG --log-prefix "IPTables-Dropped {cali-tw-cali0ded612e6fa} {9}: " --log-level 4

iptables -I cali-tw-cali6107d5f42d5 2 -j LOG --log-prefix "IPTables-Dropped {cali-tw-cali6107d5f42d5} {2}: " --log-level 4
iptables -I cali-tw-cali6107d5f42d5 9 -j LOG --log-prefix "IPTables-Dropped {cali-tw-cali6107d5f42d5} {9}: " --log-level 4

iptables -I cali-tw-cali629e28a7c35 2 -j LOG --log-prefix "IPTables-Dropped {cali-tw-cali629e28a7c35} {2}: " --log-level 4
iptables -I cali-tw-cali629e28a7c35 9 -j LOG --log-prefix "IPTables-Dropped {cali-tw-cali629e28a7c35} {9}: " --log-level 4

iptables -I cali-tw-cali9027fd99233 2 -j LOG --log-prefix "IPTables-Dropped {cali-tw-cali9027fd99233} {2}: " --log-level 4
iptables -I cali-tw-cali9027fd99233 9 -j LOG --log-prefix "IPTables-Dropped {cali-tw-cali9027fd99233} {9}: " --log-level 4

iptables -I cali-tw-calif992c1e4333 2 -j LOG --log-prefix "IPTables-Dropped {cali-tw-calif992c1e4333} {2}: " --log-level 4
iptables -I cali-tw-calif992c1e4333 9 -j LOG --log-prefix "IPTables-Dropped {cali-tw-calif992c1e4333} {9}: " --log-level 4

```
but ip chain rules get immediately overwritten. 
Can anybody confirm this?

**Comment by jsemohub** [comment]
Yep. Rules seem to be updated almost immediately with a delay of a few seconds

```
grep LOG iptables_f*
iptables_filter:5        0     0 LOG        all  --  *      *       0.0.0.0/0            0.0.0.0/0            LOG flags 0 level 4 prefix "IPTables-Dropped {cali-to-wl-"
iptables_filter:3        0     0 LOG        all  --  *      *       0.0.0.0/0            0.0.0.0/0            LOG flags 0 level 4 prefix "IPTables-Dropped {cali-to-wl-"
iptables_filter:2        0     0 LOG        all  --  *      *       0.0.0.0/0            0.0.0.0/0            LOG flags 0 level 4 prefix "IPTables-Dropped {cali-tw-cal"
iptables_filter:9        0     0 LOG        all  --  *      *       0.0.0.0/0            0.0.0.0/0            LOG flags 0 level 4 prefix "IPTables-Dropped {cali-tw-cal"
iptables_filter:2        0     0 LOG        all  --  *      *       0.0.0.0/0            0.0.0.0/0            LOG flags 0 level 4 prefix "IPTables-Dropped {cali-tw-cal"
iptables_filter:9        0     0 LOG        all  --  *      *       0.0.0.0/0            0.0.0.0/0            LOG flags 0 level 4 prefix "IPTables-Dropped {cali-tw-cal"
iptables_filter:2        0     0 LOG        all  --  *      *       0.0.0.0/0            0.0.0.0/0            LOG flags 0 level 4 prefix "IPTables-Dropped {cali-tw-cal"
iptables_filter:9        0     0 LOG        all  --  *      *       0.0.0.0/0            0.0.0.0/0            LOG flags 0 level 4 prefix "IPTables-Dropped {cali-tw-cal"
iptables_filter:2        0     0 LOG        all  --  *      *       0.0.0.0/0            0.0.0.0/0            LOG flags 0 level 4 prefix "IPTables-Dropped {cali-tw-cal"
iptables_filter:9        0     0 LOG        all  --  *      *       0.0.0.0/0            0.0.0.0/0            LOG flags 0 level 4 prefix "IPTables-Dropped {cali-tw-cal"
iptables_filter:2        0     0 LOG        all  --  *      *       0.0.0.0/0            0.0.0.0/0            LOG flags 0 level 4 prefix "IPTables-Dropped {cali-tw-cal"
iptables_filter:9        0     0 LOG        all  --  *      *       0.0.0.0/0            0.0.0.0/0            LOG flags 0 level 4 prefix "IPTables-Dropped {cali-tw-cal"

# collect nat rules in a few seconds and ... no match 
iptables -t nat -L -n -v  --line-numbers  > iptables_full; iptables -t filter -L -n -v --line-numbers  > iptables_filter
grep LOG iptables_f*  
```

**Comment by jsemohub** [comment]
Anything, anybody?

**Comment by neoaggelos** [comment]
Hi @jsemohub.

This looks like a networking issue more than anything else. My working hypothesis is that calico is inconsistent with the way it picks the underlay interface for each node, so packets cannot reach their destination. Can you please check the following:

1. The IP address shown for each node is consistent.

```
$ microk8s kubectl get node -o wide
```

2. The IP addresses used by the Calico node pod are using the same   
```
$ microk8s kubectl get pod -n kube-system -lk8s-app=calico-node -o wide
```

3. Try disabling checksum offloading, as we have seen this being an issue in the past.

```
$ microk8s kubectl patch felixconfigurations default --patch '{"spec":{"featureDetectOverride":"ChecksumOffloadBroken=true"}}' --type=merge
```

In general, avoid messing with iptables rules by hand, these are managed by Kubernetes and Calico.

**Comment by jsemohub** [comment]
Hi @neoaggelos,

Thanks for the hints. I checked 1. and 2. provide identical outputs.

I applied the patch. Do I need to restart the cluster?

**Comment by jsemohub** [comment]
Just commented out `::1` in `/etc/hosts` and it might have addressed the registry issue. Will be doing more testing.

**Comment by jsemohub** [comment]
I am also seeing these error messages after cluster restart
```
W0119 16:04:06.575797       1 reflector.go:424] k8s.io/client-go@v0.26.0/tools/cache/reflector.go:169: failed to list *v1.Challenge: the server could not find the requested resource (get challenges.acme.cert-manager.io)
E0119 16:04:06.575827       1 reflector.go:140] k8s.io/client-go@v0.26.0/tools/cache/reflector.go:169: Failed to watch *v1.Challenge: failed to list *v1.Challenge: the server could not find the requested resource (get challenges.acme.cert-manager.io)

```

**Comment by neoaggelos** [comment]
```
W0119 16:04:06.575797       1 reflector.go:424] k8s.io/client-go@v0.26.0/tools/cache/reflector.go:169: failed to list *v1.Challenge: the server could not find the requested resource (get challenges.acme.cert-manager.io)
E0119 16:04:06.575827       1 reflector.go:140] k8s.io/client-go@v0.26.0/tools/cache/reflector.go:169: Failed to watch *v1.Challenge: failed to list *v1.Challenge: the server could not find the requested resource (get challenges.acme.cert-manager.io)
```

This sounds weird, can you see the cert-manager resources in the output of `microk8s kubectl get crd`? Also, apologies but if you are installing cert-manager manually, then it is not easy to know what may be wrong.

**Comment by jsemohub** [comment]
I got it working! Thanks for the help everyone!

I think commenting out "::1" was the solution. 
I also had to re-install `ClusterIssuers `after cluster restart.

I wish it could be more straightforward. 
P.S. I was literally loosing hope:).

**Comment by neoaggelos** [comment]
Great that you sorted it out!

One thing I've seen at times is that once a certificate / cluster issuer goes to error state, then it is a bit hard to get it back working. Most often, the easiest thing to do is simply remove and recreate all resources from scratch.

Is it OK to close the issue if your problem was resolved? Can you also share the contents of your `/etc/hosts` file in case it helps future onlookers? (before and after dropping the IPv6 loopback address). Thanks a lot!

**Comment by jsemohub** [comment]
Please feel free to close the issue.

Yes. It seems to be the case that you need to recreate resources to get cert-manager going once it's stuck.
My /etc/host(s) are nothing fancy just ip4 reverse lookups for some local hosts.

Thanks again for all the help!
Cheers.
