### ISSUE TITLE
Hostname resolution failing between pods - firewalld issue

### ISSUE THREAD

**Issue by cccscdev** [canonical/microk8s#3153]
OS: CentOS 7.9.2009 (Core)
Linux 3.10.0-1160.62.1.el7.x86_64 #1 SMP Tue Apr 5 16:57:59 UTC 2022 x86_64 x86_64 x86_64 GNU/Linux
MicroK8s snap: v1.22.6    2947   1.22/stable

microk8s status

microk8s is running
high-availability: no
  datastore master nodes: 127.0.0.1:19001
  datastore standby nodes: none
addons:
  enabled:
    dashboard            # The Kubernetes dashboard
    dns                  # CoreDNS
    ha-cluster           # Configure high availability on the current node
    helm3                # Helm 3 - Kubernetes package manager
    ingress              # Ingress controller for external access
    metrics-server       # K8s Metrics Server for API access to service metrics
    prometheus           # Prometheus operator for monitoring and logging
    storage              # Storage class; allocates storage from host directory

firewalld enabled
net.ipv4.ip_forward = 1
net.bridge.bridge-nf-call-iptables = 1

**Issue Description:**

Internal hostname resolution is failing between pods within microk8s (single node deployment).

kube-system   coredns-7f9c69c78c-lzdcs                     1/1     Running
No events logged.

coredns pod logs:
E0516 11:47:03.922705       1 reflector.go:127] pkg/mod/k8s.io/client-go@v0.19.2/tools/cache/reflector.go:156: Failed to watch *v1.Service: failed to list *v1.Service: Get "https://10.152.183.1:443/api/v1/services?limit=500&resourceVersion=0": dial tcp 10.152.183.1:443: connect: no route to host
E0516 11:47:03.922826       1 reflector.go:127] pkg/mod/k8s.io/client-go@v0.19.2/tools/cache/reflector.go:156: Failed to watch *v1.Endpoints: failed to list *v1.Endpoints: Get "https://10.152.183.1:443/api/v1/endpoints?limit=500&resourceVersion=0": dial tcp 10.152.183.1:443: connect: no route to host
E0516 11:47:03.922854       1 reflector.go:127] pkg/mod/k8s.io/client-go@v0.19.2/tools/cache/reflector.go:156: Failed to watch *v1.Namespace: failed to list *v1.Namespace: Get "https://10.152.183.1:443/api/v1/namespaces?limit=500&resourceVersion=0": dial tcp 10.152.183.1:443: connect: no route to host
[INFO] plugin/ready: Still waiting on: "kubernetes"
[INFO] plugin/ready: Still waiting on: "kubernetes"
.:53
[INFO] plugin/reload: Running configuration MD5 = be0f52d3c13480652e0c73672f2fa263
CoreDNS-1.8.0
linux/amd64, go1.15.3, 054c9ae
[INFO] 127.0.0.1:46773 - 41282 "HINFO IN 4389631103927357602.3552458932074560635. udp 57 false 512" NOERROR - 0 0.000219245s
[ERROR] plugin/errors: 2 4389631103927357602.3552458932074560635. HINFO: read udp 10.1.40.92:43956->8.8.4.4:53: read: no route to host
[INFO] 127.0.0.1:52583 - 45635 "HINFO IN 4389631103927357602.3552458932074560635. udp 57 false 512" NOERROR - 0 6.010330649s
[ERROR] plugin/errors: 2 4389631103927357602.3552458932074560635. HINFO: read udp 10.1.40.92:39507->8.8.8.8:53: i/o timeout
[INFO] 127.0.0.1:42596 - 45952 "HINFO IN 4389631103927357602.3552458932074560635. udp 57 false 512" NOERROR - 0 4.001107784s
[ERROR] plugin/errors: 2 4389631103927357602.3552458932074560635. HINFO: read udp 10.1.40.92:57426->8.8.4.4:53: read: no route to host

10.152.183.1 is the kubernetes service ClusterIP
10.1.40.92 is the coredns pod IP

10.152.183.10 is the kube-dns service ClusterIP

Within my pods the /etc/resolv.conf correctly points to the kube-dns service ClusterIP:
search vault.svc.cluster.local svc.cluster.local cluster.local localdomain mycorpname.com
nameserver 10.152.183.10
options ndots:5

If I log into one pod (pod A) and try to ping a different pod (pod B) using its fully qualified name, the lookup fails:
ping -c 1 vault-consul-1.vault-consul.vault.svc.cluster.local
ping: unknown host vault-consul-1.vault-consul.vault.svc.cluster.local

However, if I stop the firewalld service and restart microk8s, the same ping test works perfectly.

I used tcpdump to analyse the network traffic and determined that the firewall is blocking traffic from the pod to the kube-dns service ClusterIP address.

In the following 10.1.40.112 is the IP of the pod from where I am initiating the ping.

06:07:37.389322 IP 10.1.40.112.49418 > 10.152.183.10.domain: 41759+ A? vault-consul-1.vault-consul.vault.svc.cluster.local. (69)
06:07:37.389412 IP 10.152.183.10 > 10.1.40.112: ICMP host 10.152.183.10 unreachable - admin prohibited, length 105
06:07:39.892893 IP 10.1.40.112.49418 > 10.152.183.10.domain: 41759+ A? vault-consul-1.vault-consul.vault.svc.cluster.local. (69)
06:07:39.892964 IP 10.152.183.10 > 10.1.40.112: ICMP host 10.152.183.10 unreachable - admin prohibited, length 105

My understanding is that microk8s / coredns takes care of automatically configuring the firewall rules.  When I dump the rules I can see there are a significant number managed by microk8s.  I've attempted to review these to try to determine if there is a blocking rule, or if there are no rules (resulting in the firewall dropping the packets by default).  The following appears to be relevant:

iptables-save | grep 10.152.183.10
-A KUBE-SERVICES -d 10.152.183.10/32 -p tcp -m comment --comment "kube-system/kube-dns:metrics cluster IP" -m tcp --dport 9153 -j KUBE-SVC-JD5MR3NA4I4DYORP
-A KUBE-SERVICES -d 10.152.183.10/32 -p udp -m comment --comment "kube-system/kube-dns:dns cluster IP" -m udp --dport 53 -j KUBE-SVC-TCOU7JCQXEZGVUNU
-A KUBE-SERVICES -d 10.152.183.10/32 -p tcp -m comment --comment "kube-system/kube-dns:dns-tcp cluster IP" -m tcp --dport 53 -j KUBE-SVC-ERIFXISQEP7F7OF4
-A KUBE-SVC-ERIFXISQEP7F7OF4 ! -s 10.1.0.0/16 -d 10.152.183.10/32 -p tcp -m comment --comment "kube-system/kube-dns:dns-tcp cluster IP" -m tcp --dport 53 -j KUBE-MARK-MASQ
-A KUBE-SVC-JD5MR3NA4I4DYORP ! -s 10.1.0.0/16 -d 10.152.183.10/32 -p tcp -m comment --comment "kube-system/kube-dns:metrics cluster IP" -m tcp --dport 9153 -j KUBE-MARK-MASQ
-A KUBE-SVC-TCOU7JCQXEZGVUNU ! -s 10.1.0.0/16 -d 10.152.183.10/32 -p udp -m comment --comment "kube-system/kube-dns:dns cluster IP" -m udp --dport 53 -j KUBE-MARK-MASQ

iptables-save | grep KUBE-SVC-TCOU7JCQXEZGVUNU
:KUBE-SVC-TCOU7JCQXEZGVUNU - [0:0]
-A KUBE-SERVICES -d 10.152.183.10/32 -p udp -m comment --comment "kube-system/kube-dns:dns cluster IP" -m udp --dport 53 -j KUBE-SVC-TCOU7JCQXEZGVUNU
-A KUBE-SVC-TCOU7JCQXEZGVUNU ! -s 10.1.0.0/16 -d 10.152.183.10/32 -p udp -m comment --comment "kube-system/kube-dns:dns cluster IP" -m udp --dport 53 -j KUBE-MARK-MASQ
-A KUBE-SVC-TCOU7JCQXEZGVUNU -m comment --comment "kube-system/kube-dns:dns" -j KUBE-SEP-AZVCPYP2YXRJOYK6

I did attempt to insert some rules to see if these resolved the issue, but these did not work:

-A INPUT -i any -p udp -m comment --comment "testing - kube-dns:dns cluster IP" -m udp --dport 53 -j ACCEPT
-A INPUT -d 10.152.183.10/32 -i any -p udp -m comment --comment "testing - kube-dns:dns cluster IP" -m udp --dport 53 -j ACCEPT
-A INPUT -s 10.1.0.0/16 -d 10.152.183.10/32 -i any -p udp -m comment --comment "testing - kube-dns:dns cluster IP" -m udp --dport 53 -j ACCEPT

Is my understanding correct that these rules should be automatically managed, or am I missing a configuration step somewhere?  I have previously deployed to Ubuntu without issue, but this issue had occurred on two different CentOS instances that I have deployed to.  A colleague has independently hit the same issue on a different CentOS instance he is working on too.

Any help or suggestions on how I can fix this - or pointers to help me troubleshoot further would be much appreciated.

**Comment by berkayoz** [comment]
Thank you for reporting the issue.

Could you run `microk8s inspect` and attach the generated tarball please?

Also there is a section on the [troubleshooting page](https://microk8s.io/docs/troubleshooting) named `Pod communication problems when using firewall-cmd (Fedora etc) `about firewalld which might help.

**Comment by cccscdev** [comment]
Thanks berkayoz - the troubleshooting section resolved my issue!
